id,title,description,category
1,Red Running Shoes,Lightweight running shoes for daily jogging and comfort,sports
2,Blue Basketball Shoes,High ankle support shoes designed for basketball players,sports
3,Wireless Mouse,Compact bluetooth mouse for office and travel,electronics
4,Mechanical Keyboard,Keyboard with tactile switches for coding and gaming,electronics
5,Coffee Mug,Ceramic mug suitable for tea coffee and hot drinks,home
6,Water Bottle,Insulated stainless steel bottle that keeps water cold,home